{
  "session_id": "hyperplan-oh-my-cursor-2026-06-08",
  "round": 2,
  "claims": [],
  "counterclaims": [],
  "evidence": [],
  "unresolved": [],
  "consensus_items": [
    "All round-1 P0 items resolved in spec revision",
    "Secret trust contract adopted",
    "Install allowlist + copy-default migration adopted",
    "DEF-09 read/write helper split adopted",
    "Estimate re-baselined to 5-7 days",
    "Dual-read sunset v2.0.0 adopted",
    "Spec status: accepted"
  ]
}
